{
  "pack": "12-cargo-extraction-risk",
  "scenarioId": "CARGO-UNKNOWN",
  "runId": "CARGO-UNKNOWN-bal-L15-P6-E5",
  "seed": 9415333,
  "sourceHash": "6db62c7f6cf4ad5e4cb940ba2f4fdb373d94dc327a6d990b238c59e9e1f29797",
  "fixtureHash": null,
  "evidenceLevel": "A",
  "outcome": "aggregated_monte_carlo",
  "metrics": {
    "n": 2500,
    "level": 15,
    "party": 6,
    "extractionClass": 5,
    "policy": "balanced",
    "mapping": "Unknown",
    "havenRate": 1.0,
    "meanRetainedLoadFrac": 0.5148,
    "medianRetainedLoadFrac": 1.0,
    "cargoLossRate": 0.4852,
    "meanExtractionFailCount": 0.534,
    "meanCasualties": 0.275,
    "meanTrueProfit": 758.95,
    "medianTrueProfit": 1490.8,
    "profitP10": -108.0,
    "profitP90": 1576.8
  },
  "rulesHalts": [
    {
      "code": "UNKNOWN-PROGRESS-ZERO",
      "note": "progressPerWatch.Unknown=0; without Map Route success, expedition cannot meet Progress targets \u2014 intentional deadlock risk."
    },
    {
      "code": "EXTRACTION-HANDLING-MODS",
      "note": "extraction.test cites handling modifiers beyond cargoDcModifierByHighestClass/attentionDcModifier; no numeric handling schedule in Loop JSON \u2014 sim uses 0."
    }
  ],
  "findings": [],
  "rawEvidencePath": "results/CARGO-UNKNOWN/bal-L15-P6-E5.json"
}