{
  "pack": "12-cargo-extraction-risk",
  "scenarioId": "CARGO-ATTENTION",
  "runId": "CARGO-ATTENTION-bal-L10-P6-E4",
  "seed": 2402645,
  "sourceHash": "2f3167ff71e5c9ad99278e3d72bce48298bb71b3b9d623e430eea2851bd76ab8",
  "fixtureHash": null,
  "evidenceLevel": "A",
  "outcome": "aggregated_monte_carlo",
  "metrics": {
    "n": 5000,
    "level": 10,
    "party": 6,
    "extractionClass": 4,
    "policy": "balanced",
    "mapping": "Sketched",
    "havenRate": 1.0,
    "meanRetainedLoadFrac": 0.5472,
    "medianRetainedLoadFrac": 1.0,
    "cargoLossRate": 0.4528,
    "meanExtractionFailCount": 0.482,
    "meanCasualties": 0.291,
    "meanTrueProfit": 147.04,
    "medianTrueProfit": 310.0,
    "profitP10": -122.0,
    "profitP90": 360.0
  },
  "rulesHalts": [
    {
      "code": "EXTRACTION-CARGO-DC-MODS",
      "note": "extraction.test cites 'cargo modifiers' without numeric schedule in Gameplay Loop JSON; sim uses +EC to DC as chassis proxy."
    }
  ],
  "findings": [],
  "rawEvidencePath": "results/CARGO-ATTENTION/bal-L10-P6-E4.json"
}