{
  "pack": "12-cargo-extraction-risk",
  "scenarioId": "CARGO-CASUALTY",
  "runId": "CARGO-CASUALTY-agg-L5-P4-E2",
  "seed": 8830692,
  "sourceHash": "2f3167ff71e5c9ad99278e3d72bce48298bb71b3b9d623e430eea2851bd76ab8",
  "fixtureHash": null,
  "evidenceLevel": "A",
  "outcome": "aggregated_monte_carlo",
  "metrics": {
    "n": 2500,
    "level": 5,
    "party": 4,
    "extractionClass": 2,
    "policy": "aggressive",
    "mapping": "Mapped",
    "havenRate": 1.0,
    "meanRetainedLoadFrac": 0.7624,
    "medianRetainedLoadFrac": 1.0,
    "cargoLossRate": 0.2376,
    "meanExtractionFailCount": 0.35,
    "meanCasualties": 1.025,
    "meanTrueProfit": 28.32,
    "medianTrueProfit": 58.12,
    "profitP10": -62.0,
    "profitP90": 58.12
  },
  "rulesHalts": [
    {
      "code": "EXTRACTION-CARGO-DC-MODS",
      "note": "extraction.test cites 'cargo modifiers' without numeric schedule in Gameplay Loop JSON; sim uses +EC to DC as chassis proxy."
    }
  ],
  "findings": [],
  "rawEvidencePath": "results/CARGO-CASUALTY/agg-L5-P4-E2.json"
}