{
  "pack": "12-cargo-extraction-risk",
  "scenarioId": "CARGO-ATTENTION",
  "runId": "CARGO-ATTENTION-agg-L15-P6-E4",
  "seed": 8392529,
  "sourceHash": "6db62c7f6cf4ad5e4cb940ba2f4fdb373d94dc327a6d990b238c59e9e1f29797",
  "fixtureHash": null,
  "evidenceLevel": "A",
  "outcome": "aggregated_monte_carlo",
  "metrics": {
    "n": 5000,
    "level": 15,
    "party": 6,
    "extractionClass": 4,
    "policy": "aggressive",
    "mapping": "Sketched",
    "havenRate": 1.0,
    "meanRetainedLoadFrac": 0.4892,
    "medianRetainedLoadFrac": 0.0,
    "cargoLossRate": 0.5108,
    "meanExtractionFailCount": 0.525,
    "meanCasualties": 0.343,
    "meanTrueProfit": 776.41,
    "medianTrueProfit": -36.0,
    "profitP10": -158.0,
    "profitP90": 1725.12
  },
  "rulesHalts": [
    {
      "code": "EXTRACTION-HANDLING-MODS",
      "note": "extraction.test cites handling modifiers beyond cargoDcModifierByHighestClass/attentionDcModifier; no numeric handling schedule in Loop JSON \u2014 sim uses 0."
    }
  ],
  "findings": [],
  "rawEvidencePath": "results/CARGO-ATTENTION/agg-L15-P6-E4.json"
}