{
  "pack": "12-cargo-extraction-risk",
  "scenarioId": "CARGO-LIGHT",
  "runId": "CARGO-LIGHT-cau-L3-P4-E1",
  "seed": 1928992,
  "sourceHash": "2f3167ff71e5c9ad99278e3d72bce48298bb71b3b9d623e430eea2851bd76ab8",
  "fixtureHash": null,
  "evidenceLevel": "A",
  "outcome": "aggregated_monte_carlo",
  "metrics": {
    "n": 5000,
    "level": 3,
    "party": 4,
    "extractionClass": 1,
    "policy": "cautious",
    "mapping": "Mapped",
    "havenRate": 1.0,
    "meanRetainedLoadFrac": 0.7894,
    "medianRetainedLoadFrac": 1.0,
    "cargoLossRate": 0.2106,
    "meanExtractionFailCount": 0.296,
    "meanCasualties": 0.04,
    "meanTrueProfit": -1.22,
    "medianTrueProfit": 4.17,
    "profitP10": -12.0,
    "profitP90": 4.17
  },
  "rulesHalts": [
    {
      "code": "EXTRACTION-CARGO-DC-MODS",
      "note": "extraction.test cites 'cargo modifiers' without numeric schedule in Gameplay Loop JSON; sim uses +EC to DC as chassis proxy."
    }
  ],
  "findings": [],
  "rawEvidencePath": "results/CARGO-LIGHT/cau-L3-P4-E1.json"
}