{
  "pack": "12-cargo-extraction-risk",
  "scenarioId": "CARGO-LIGHT",
  "runId": "CARGO-LIGHT-agg-L3-P4-E0",
  "seed": 5418623,
  "sourceHash": "2f3167ff71e5c9ad99278e3d72bce48298bb71b3b9d623e430eea2851bd76ab8",
  "fixtureHash": null,
  "evidenceLevel": "A",
  "outcome": "aggregated_monte_carlo",
  "metrics": {
    "n": 5000,
    "level": 3,
    "party": 4,
    "extractionClass": 0,
    "policy": "aggressive",
    "mapping": "Mapped",
    "havenRate": 1.0,
    "meanRetainedLoadFrac": 0.8342,
    "medianRetainedLoadFrac": 1.0,
    "cargoLossRate": 0.1658,
    "meanExtractionFailCount": 0.245,
    "meanCasualties": 0.022,
    "meanTrueProfit": 3.62,
    "medianTrueProfit": 8.02,
    "profitP10": -12.0,
    "profitP90": 8.02
  },
  "rulesHalts": [],
  "findings": [],
  "rawEvidencePath": "results/CARGO-LIGHT/agg-L3-P4-E0.json"
}